Input Sentence,Next Sentence,LL Difference Scores,Average Similarity Scores
"What is the meaning of life, the universe, and everything?",It's a beautiful thing.,24.22157382965088,0.8554711937904358
It's a beautiful thing.,I know.,15.69055461883545,0.792660117149353
I know.,"Well, it's a very beautiful thing, isn't it?",10.735231399536133,0.8624060153961182
"Well, it's a very beautiful thing, isn't it?",Yes.,29.252456188201904,0.7851312756538391
Yes.,"You know what? I just want to say that, I am really glad you guys are here.",4.314422607421875,0.802839994430542
"You know what? I just want to say that, I am really glad you guys are here.",Thanks.,48.876912117004395,0.6483703255653381
